{
  "schemaVersion": 1,
  "preregistration": {
    "tag": "paper85-prereg-v1",
    "commitSha": "f3ff71de8fd4634cf37f2c9b980e0c7d92e436a2",
    "manifestSha256": "97eabdaab3de5cc4d3cb41bbce1b82e445edfa7c8ea060618dc7b51fa5be4c69"
  },
  "sourceArtifact": {
    "tag": "chapter3-artifact-v1.4.0",
    "commitSha": "e5b1e126e5e7ff37f5fe47307d945447724a17d1",
    "evidenceAnchor": "b5fe1c8ec2153d1e84e0492012be44a45182dfe2"
  },
  "run": {
    "runId": "ablation-20260808T064214471Z",
    "startedAt": "2026-08-08T06:42:14.471Z",
    "chainId": 31337,
    "genesisTimestamp": 1710000000,
    "toolchain": {
      "foundry": "forge Version: 1.7.1"
    }
  },
  "counts": {
    "total": 210,
    "perVariant": {
      "M1": 42,
      "M2": 42,
      "M3": 42,
      "M4": 42,
      "M5": 42
    },
    "targeted": 24,
    "nonTargeted": 186,
    "classifications": {
      "expected_accept": 90,
      "expected_reject": 96,
      "invalid_transition_accepted": 22,
      "rejected_by_residual_guard": 1,
      "runtime_revert": 1
    },
    "targetedClassifications": {
      "invalid_transition_accepted": 22,
      "rejected_by_residual_guard": 1,
      "runtime_revert": 1
    },
    "failed": 0
  },
  "metrics": {
    "preregisteredClassificationMatchRate": 1,
    "targetedAnomalyMatchRate": 1,
    "repeatedDigestMatches": 210,
    "repeatedDigestMismatches": 0,
    "targetedStateDivergences": 22,
    "targetedEventDivergences": 22
  },
  "evidenceManifestSha256": "6939266f03519cb506c087d6de07c485add317417b0bbec2ec48909f5e49dfc6"
}
