{
  "schemaVersion": 1,
  "preregistration": {
    "tag": "paper85-prereg-v1",
    "commitSha": "f3ff71de8fd4634cf37f2c9b980e0c7d92e436a2",
    "manifestSha256": "97eabdaab3de5cc4d3cb41bbce1b82e445edfa7c8ea060618dc7b51fa5be4c69"
  },
  "sourceArtifact": {
    "tag": "chapter3-artifact-v1.4.0",
    "commitSha": "e5b1e126e5e7ff37f5fe47307d945447724a17d1",
    "evidenceAnchor": "b5fe1c8ec2153d1e84e0492012be44a45182dfe2"
  },
  "run": {
    "runId": "m0-20260808T125027027Z",
    "startedAt": "2026-08-08T12:50:27.027Z",
    "chainId": 31337,
    "genesisTimestamp": 1710000000,
    "toolchain": {
      "foundry": "forge Version: 1.7.1"
    },
    "repository": {
      "headCommit": "d27d99067f4f03f81b6e72ff2cc0744e05316edd",
      "branch": "test/paper85-v21-evidence",
      "dirty": false
    },
    "measurement": {
      "preregistrationLockSha256": "1cf0cabc595610693f74929dccaa9369b18dca9024a6af3f12ba9dc73d18c28b",
      "evaluationLockSha256": "758687070f521d83225da36db79867ce612007f07c25fbffe5e642a2f49e0090",
      "stateAssertionSpecSha256": "9d3a94b32a0481e937be2f4bbc539b692e3dc5748d4191f5242f6defaa258057"
    }
  },
  "counts": {
    "total": 42,
    "valid": 18,
    "invalid": 24,
    "m0Equivalent": 42,
    "failed": 0
  },
  "metrics": {
    "semanticEquivalenceRate": 1,
    "repeatedDigestMatches": 42,
    "repeatedDigestMismatches": 0,
    "semanticEvidenceSha256": "56e78b202a16f5a8b236f107991b4c5804db54cfe7784b6b1681682b499f1c19"
  },
  "evidenceManifestSha256": "1f9a3ee8388a202928a3d7ed2df122915222f6022f25a4af5386998fd5f8754d"
}
