{
  "schemaVersion": 1,
  "preregistration": {
    "tag": "paper85-prereg-v1",
    "commitSha": "f3ff71de8fd4634cf37f2c9b980e0c7d92e436a2",
    "manifestSha256": "97eabdaab3de5cc4d3cb41bbce1b82e445edfa7c8ea060618dc7b51fa5be4c69"
  },
  "sourceArtifact": {
    "tag": "chapter3-artifact-v1.4.0",
    "commitSha": "e5b1e126e5e7ff37f5fe47307d945447724a17d1",
    "evidenceAnchor": "b5fe1c8ec2153d1e84e0492012be44a45182dfe2"
  },
  "run": {
    "runId": "m0-20260808T064015786Z",
    "startedAt": "2026-08-08T06:40:15.786Z",
    "chainId": 31337,
    "genesisTimestamp": 1710000000,
    "toolchain": {
      "foundry": "forge Version: 1.7.1"
    }
  },
  "counts": {
    "total": 42,
    "valid": 18,
    "invalid": 24,
    "m0Equivalent": 42,
    "failed": 0
  },
  "metrics": {
    "semanticEquivalenceRate": 1,
    "repeatedDigestMatches": 42,
    "repeatedDigestMismatches": 0
  },
  "evidenceManifestSha256": "fa7d39950844e177fe0019dd55797b437f3fcb6ee431a47556a0605fb9ca95a0"
}
